{
  "uid": "strategic-milestones-json",
  "name": "Strategic Milestones Json",
  "description": "Generated data input for registry reference normalization: strategic-milestones-json.",
  "schemaType": "hybrid",
  "sourceType": "json",
  "requiredFields": [
    "timestamp",
    "source",
    "payload"
  ],
  "sampleSource": "generated/from-workflow/elina/sop-autonomous-queue-management",
  "privacyClassification": "internal"
}
